{
  "$schema": "../../../../schemas/v1/capability-submission.schema.json",
  "contract_version": "1.0",
  "outcome": "accepted",
  "request_digest": "sha256:d9a8274483bbf7d3f4a6a4f1b48b0666321bb4fd264a3f3425d8f86d7ab2cc45",
  "request_id": "request-example-001",
  "status_ref": "status:request-example-001",
  "submitted_at": "2026-08-05T20:00:02Z"
}
