{"$schema":"../../schemas/v1/capability-submission.schema.json","contract_version":"1.0","outcome":"accepted","request_digest":"sha256:d74624c1ee49c193a4077e8833d91a9aaff1575bdcfc412a116153078d01059d","request_id":"request-example-001","status_ref":"status:request-example-001","submitted_at":"2026-08-05T20:00:02Z"}
